{
  "$schema": "../../schemas/strategy_specification.schema.json",
  "strategy_id": "STRAT-20260902-ORB_MOM-M5-v1.1",
  "timestamp": "2026-09-02T23:30:00Z",
  "hypothesis": {
    "condition_x": "Se define el Rango de Apertura (OR) como el maximo y minimo de las primeras N_or=3 velas M5 (15 minutos) tras la apertura de la sesion regular de EEUU (13:30 UTC). En cada vela M5 posterior al OR, y unicamente hasta las 14:30 UTC (la 'hora dorada' post-apertura), se calcula ROC_i = (Close_i - Close_i-1) / Close_i-1. Si tres valores consecutivos de ROC son crecientes y del mismo signo (ROC_i > ROC_i-1 > ROC_i-2, con ROC_i > 0 para largos o ROC_i < 0 para cortos) Y el Close de la vela actual rompe el extremo del OR (Close > OR_high para largos, Close < OR_low para cortos), se genera la señal de entrada.",
    "expected_outcome_y": "Continuacion direccional del precio con un objetivo de ganancia mas alcanzable dentro de una sola sesion (1.0x ATR Diario en vez de 1.5x), dado que el analisis del backtest v1.0 mostro que el 89.5% de las salidas ocurrian por cierre de sesion y no por Take Profit -evidencia de que el objetivo original era demasiado ambicioso para el marco temporal intradia.",
    "structural_reason_z": "Fisher (ACD Method) y Crabel documentan que la mayor parte del rango direccional del dia se define en la primera hora posterior a la apertura; entradas tardias (verificadas en v1.0 hasta las 19:45 UTC) tienen estructuralmente menos tiempo para desarrollarse antes del cierre forzado de sesion, lo cual explica la alta proporcion de salidas por tiempo observada en el backtest inicial.",
    "invalidation_criterion": "El precio retorna dentro del Rango de Apertura con cierre de una vela M5 nuevamente dentro del OR tras haberlo roto (fallo de ruptura), o el Z-Score de volatilidad diaria cae por debajo del umbral antes de la confirmacion de la señal."
  },
  "market_regime_mtf": {
    "model": "Lopez_de_Prado_Daily_ZScore",
    "regime_timeframe": "D1",
    "execution_timeframe": "M5",
    "fast_atr_period": 5,
    "slow_atr_period": 14,
    "zscore_threshold_high": 0.67,
    "zscore_threshold_low": -0.67,
    "target_history_years_range": [5, 10]
  },
  "execution_rules": {
    "entry_long": {
      "trigger_formula_latex": "ROC_i = \\frac{C_i - C_{i-1}}{C_{i-1}}; \\quad OR_{high} = \\max(H_1,\\ldots,H_{N_{or}}); \\quad C_i > OR_{high} \\;\\wedge\\; ROC_i > ROC_{i-1} > ROC_{i-2} > 0",
      "pseudocode": "ON new_session_day: N_or = 3; compute OR_high = MAX(High[1..N_or]), OR_low = MIN(Low[1..N_or]) usando las primeras N_or velas M5 tras session_open (13:30 UTC). ON each M5 bar confirmed AFTER the OR window AND BEFORE entry_window_end (14:30 UTC), WHILE flat: roc = (Close - Close[1]) / Close[1]; IF roc > roc[1] AND roc[1] > roc[2] AND roc > 0 AND Close > OR_high AND z_vol > zscore_threshold_high AND is_warmed_up THEN BuySignal = TRUE",
      "canonical_citation": "Toby Crabel (1990) - Opening Range y volatilidad de apertura; Mark Fisher - ACD Method (A-Range, 'hora dorada'); Marcos Lopez de Prado (2018) - Filtro de Regimen de Volatilidad Diaria (Z-Score); Perry J. Kaufman - Rate of Change como medida de aceleracion direccional."
    },
    "entry_short": {
      "trigger_formula_latex": "ROC_i = \\frac{C_i - C_{i-1}}{C_{i-1}}; \\quad OR_{low} = \\min(L_1,\\ldots,L_{N_{or}}); \\quad C_i < OR_{low} \\;\\wedge\\; ROC_i < ROC_{i-1} < ROC_{i-2} < 0",
      "pseudocode": "ON new_session_day: N_or = 3; compute OR_high = MAX(High[1..N_or]), OR_low = MIN(Low[1..N_or]) usando las primeras N_or velas M5 tras session_open (13:30 UTC). ON each M5 bar confirmed AFTER the OR window AND BEFORE entry_window_end (14:30 UTC), WHILE flat: roc = (Close - Close[1]) / Close[1]; IF roc < roc[1] AND roc[1] < roc[2] AND roc < 0 AND Close < OR_low AND z_vol > zscore_threshold_high AND is_warmed_up THEN SellSignal = TRUE",
      "canonical_citation": "Toby Crabel (1990) - Opening Range y volatilidad de apertura; Mark Fisher - ACD Method (A-Range, 'hora dorada'); Marcos Lopez de Prado (2018) - Filtro de Regimen de Volatilidad Diaria (Z-Score); Perry J. Kaufman - Rate of Change como medida de aceleracion direccional."
    },
    "session_window_utc": {
      "start_time": "16:45",
      "end_time": "17:30"
    },
    "session_window_note": "Horarios en tiempo del servidor/broker (Pepperstone-Demo), no UTC. Verificado empiricamente: el backtest v1.0 (ventana amplia) mostro que las 276 señales de entrada ocurrieron exclusivamente entre las 16:35 y las 19:50 hora servidor, evidenciando que la apertura real de NVDA.US en este broker es ~16:30 servidor, no 13:30 como se asumio inicialmente (offset aprox. UTC+3)."
  },
  "triple_barrier_exits": {
    "barrier_1_profit_atr_d1_multiplier": 1.0,
    "barrier_2_stop_atr_multiplier": 0.5,
    "barrier_3_time_stop_max_bars": 75
  },
  "research_purity_declaration": {
    "live_execution_filters_omitted": true,
    "unrequested_passive_protections": false
  }
}
