{
  "$schema": "../../schemas/strategy_specification.schema.json",
  "strategy_id": "STRAT-20260903-GOLD_SMA_CROSS-M30-v1.1",
  "timestamp": "2026-09-03T13:40:00Z",
  "hypothesis": {
    "condition_x": "En vela cerrada de M30 (shift = 1), la SMA rápida de 20 periodos cruza por encima de la SMA lenta de 50 periodos condicionado a que el precio de cierre esté por encima de la EMA 200 en M30 (modo Long-Only optimizado por asimetría direccional).",
    "expected_outcome_y": "Maximización de la esperanza matemática (E > +2.50 USD/trade) y elevación del Profit Factor (> 1.40) al descartar las posiciones en corto, con toma de beneficios calibrada en la masa modal de MFE (1.10x ATR Diario) y blindaje mediante Breakeven elástico (+0.50x ATR D1).",
    "structural_reason_z": "La tendencia macro secular alcista del Oro y la masa de flujo institucional penaliza sistemáticamente los cruces bajistas en temporalidades intermedias. Concentrar el capital en las compras alineadas con la marea semanal y proteger las ganancias tempranas elimina la degradación por reversa.",
    "invalidation_criterion": "Cierre de vela M30 con cruce opuesto de SMA 20/50, activación de Breakeven o ejecución del Stop Loss de 0.75x ATR Diario."
  },
  "market_regime_mtf": {
    "model": "Lopez_de_Prado_Daily_ZScore",
    "regime_timeframe": "D1",
    "execution_timeframe": "M30",
    "fast_atr_period": 5,
    "slow_atr_period": 14,
    "zscore_threshold_high": 0.0,
    "zscore_threshold_low": -0.67,
    "target_history_years_range": [5, 10]
  },
  "execution_rules": {
    "entry_long": {
      "trigger_formula_latex": "\\text{SMA}_{20}[1] > \\text{SMA}_{50}[1] \\;\\wedge\\; \\text{SMA}_{20}[2] \\leq \\text{SMA}_{50}[2] \\;\\wedge\\; C_{M30}[1] > \\text{EMA}_{200}[1] \\;\\wedge\\; \\text{CircuitBreaker} = \\text{False}",
      "pseudocode": "IF (sma20[1] > sma50[1] AND sma20[2] <= sma50[2]) AND (Close[1] > ema200[1]) AND NOT circuit_breaker_active AND is_warmed_up AND flat THEN BuySignal = TRUE",
      "canonical_citation": "Perry J. Kaufman (2013) - Trading Systems and Methods; Alexander Elder (1993, 2014) - Triple Screen System & Circuit Breaker."
    },
    "session_window_utc": {
      "start_time": "00:00",
      "end_time": "23:59"
    }
  },
  "triple_barrier_exits": {
    "barrier_1_profit_atr_d1_multiplier": 1.10,
    "barrier_2_stop_atr_multiplier": 0.75,
    "barrier_3_time_stop_max_bars": 48
  },
  "research_purity_declaration": {
    "live_execution_filters_omitted": true,
    "unrequested_passive_protections": false
  }
}
