{
  "$schema": "../../schemas/strategy_specification.schema.json",
  "strategy_id": "STRAT-20260903-GOLD_SMA_CROSS-M30-v1.0",
  "timestamp": "2026-09-03T13:25:00Z",
  "hypothesis": {
    "condition_x": "En vela cerrada de M30 (shift = 1), la SMA rapida de 20 periodos cruza por encima de la SMA lenta de 50 periodos, condicionado a que el precio de cierre este estrictamente por encima de la EMA 200 en M30 para largos (o cruce bajista con Close < EMA 200 para cortos).",
    "expected_outcome_y": "Captura del impulso inercial direccional intermedio con un ratio beneficio/riesgo de 2.0 a 1, eliminando la mayoria de los quiebres falsos (whipsaws) que ocurren en rangos laterales contra la marea institucional de largo plazo.",
    "structural_reason_z": "Fundamentado en Perry Kaufman (Trading Systems and Methods) y Alexander Elder (Triple Screen Trading). Los cruces intermedios de medias simples (20/50) filtran el ruido intradiario menor y reflejan la transicion entre acumulacion y tendencia; su alineacion obligatoria con la EMA 200 garantiza que solo se explote el momentum cuando el flujo macroinstitucional respalda la direccion.",
    "invalidation_criterion": "Cierre de vela M30 con cruce opuesto de SMA 20/50, o ejecucion de la Barrera 2 de Stop Loss anclada al 0.75x ATR Diario."
  },
  "market_regime_mtf": {
    "model": "Lopez_de_Prado_Daily_ZScore",
    "regime_timeframe": "D1",
    "execution_timeframe": "M30",
    "fast_atr_period": 5,
    "slow_atr_period": 14,
    "zscore_threshold_high": 0.0,
    "zscore_threshold_low": -0.67,
    "target_history_years_range": [5, 10]
  },
  "execution_rules": {
    "entry_long": {
      "trigger_formula_latex": "\\text{SMA}_{20}[1] > \\text{SMA}_{50}[1] \\;\\wedge\\; \\text{SMA}_{20}[2] \\leq \\text{SMA}_{50}[2] \\;\\wedge\\; C_{M30}[1] > \\text{EMA}_{200}[1]",
      "pseudocode": "IF (sma20[1] > sma50[1] AND sma20[2] <= sma50[2]) AND (Close[1] > ema200[1]) AND is_warmed_up AND flat THEN BuySignal = TRUE",
      "canonical_citation": "Perry J. Kaufman (2013) - Trading Systems and Methods; Alexander Elder (1993) - Trading for a Living."
    },
    "entry_short": {
      "trigger_formula_latex": "\\text{SMA}_{20}[1] < \\text{SMA}_{50}[1] \\;\\wedge\\; \\text{SMA}_{20}[2] \\geq \\text{SMA}_{50}[2] \\;\\wedge\\; C_{M30}[1] < \\text{EMA}_{200}[1]",
      "pseudocode": "IF (sma20[1] < sma50[1] AND sma20[2] >= sma50[2]) AND (Close[1] < ema200[1]) AND is_warmed_up AND flat THEN SellSignal = TRUE",
      "canonical_citation": "Perry J. Kaufman (2013) - Trading Systems and Methods; Alexander Elder (1993) - Trading for a Living."
    },
    "session_window_utc": {
      "start_time": "00:00",
      "end_time": "23:59"
    }
  },
  "triple_barrier_exits": {
    "barrier_1_profit_atr_d1_multiplier": 1.5,
    "barrier_2_stop_atr_multiplier": 0.75,
    "barrier_3_time_stop_max_bars": 48
  },
  "research_purity_declaration": {
    "live_execution_filters_omitted": true,
    "unrequested_passive_protections": false
  }
}
